{
  "schema_version": "0.1",
  "company": "Apple Inc. Public-Source Static Case Study",
  "ticker": "AAPL",
  "as_of": "2024-05-03",
  "data_cutoff": "2024-05-02",
  "source_attribution": [
    {
      "source_name": "Apple reports second quarter results",
      "publisher": "Apple",
      "source_type": "company_investor_relations",
      "source_url": "https://www.apple.com/newsroom/2024/05/apple-reports-second-quarter-results/",
      "accessed_at": "2026-05-17",
      "static_notice": "Static educational case-study fixture assembled from public URLs; not live data."
    },
    {
      "source_name": "Apple FY2023 Form 10-K",
      "publisher": "U.S. SEC EDGAR",
      "source_type": "sec_filing",
      "source_url": "https://www.sec.gov/Archives/edgar/data/320193/000032019323000106/aapl-20230930.htm",
      "accessed_at": "2026-05-17",
      "static_notice": "Static educational case-study fixture assembled from a public SEC URL; not live data."
    }
  ],
  "notes": [
    {
      "id": "aapl-q2-revenue",
      "date": "2024-05-02",
      "topic": "quarterly revenue",
      "type": "management_claim",
      "text": "Company release described quarterly revenue as down year over year while EPS was reported as a March-quarter record.",
      "evidence_url": "https://www.apple.com/newsroom/2024/05/apple-reports-second-quarter-results/",
      "source_attribution": [
        {
          "source_name": "Apple Q2 FY2024 results release",
          "publisher": "Apple",
          "source_type": "company_investor_relations",
          "source_url": "https://www.apple.com/newsroom/2024/05/apple-reports-second-quarter-results/",
          "accessed_at": "2026-05-17",
          "static_notice": "Static public-source excerpt; verify against the original release."
        }
      ]
    },
    {
      "id": "aapl-services-growth",
      "date": "2024-05-02",
      "topic": "services revenue",
      "type": "management_claim",
      "text": "Management described services as reaching an all-time revenue record, a possible growth tailwind for review.",
      "evidence_url": "https://www.apple.com/newsroom/2024/05/apple-reports-second-quarter-results/",
      "source_attribution": [
        {
          "source_name": "Apple Q2 FY2024 results release",
          "publisher": "Apple",
          "source_type": "company_investor_relations",
          "source_url": "https://www.apple.com/newsroom/2024/05/apple-reports-second-quarter-results/",
          "accessed_at": "2026-05-17",
          "static_notice": "Static public-source excerpt; verify against the original release."
        }
      ]
    },
    {
      "id": "aapl-risk-factors-static",
      "date": "2023-09-30",
      "topic": "risk factors",
      "type": "sec_filing_excerpt",
      "text": "Prior Form 10-K risk-factor context covers competitive pressure, supply constraints, regulatory matters, and potential margin pressure.",
      "evidence_url": "https://www.sec.gov/Archives/edgar/data/320193/000032019323000106/aapl-20230930.htm",
      "source_attribution": [
        {
          "source_name": "Apple FY2023 Form 10-K",
          "publisher": "U.S. SEC EDGAR",
          "source_type": "sec_filing",
          "source_url": "https://www.sec.gov/Archives/edgar/data/320193/000032019323000106/aapl-20230930.htm",
          "accessed_at": "2026-05-17",
          "static_notice": "Static public SEC filing reference; stale badge is expected."
        }
      ]
    }
  ],
  "kpis": [
    {
      "name": "Quarterly revenue",
      "value": "$90.8B",
      "direction": "down",
      "date": "2024-05-02",
      "observation": "Static case-study value from the company release; year-over-year decline creates a review prompt.",
      "evidence_url": "https://www.apple.com/newsroom/2024/05/apple-reports-second-quarter-results/",
      "source_attribution": [
        {
          "source_name": "Apple Q2 FY2024 results release",
          "publisher": "Apple",
          "source_type": "company_investor_relations",
          "source_url": "https://www.apple.com/newsroom/2024/05/apple-reports-second-quarter-results/",
          "accessed_at": "2026-05-17",
          "static_notice": "Static case-study KPI; not live data."
        }
      ]
    },
    {
      "name": "Services revenue",
      "value": "$23.9B",
      "direction": "up",
      "date": "2024-05-02",
      "observation": "Static case-study value from the company release; services growth is an opportunity prompt.",
      "evidence_url": "https://www.apple.com/newsroom/2024/05/apple-reports-second-quarter-results/",
      "source_attribution": [
        {
          "source_name": "Apple Q2 FY2024 results release",
          "publisher": "Apple",
          "source_type": "company_investor_relations",
          "source_url": "https://www.apple.com/newsroom/2024/05/apple-reports-second-quarter-results/",
          "accessed_at": "2026-05-17",
          "static_notice": "Static case-study KPI; not live data."
        }
      ]
    }
  ],
  "catalysts": [
    {
      "date": "2024-06-10",
      "title": "WWDC 2024 review point",
      "description": "Static case-study catalyst to review public product and platform updates after the Q2 FY2024 release.",
      "expected_impact": "opportunity review",
      "evidence_url": "https://www.apple.com/newsroom/2024/05/apple-reports-second-quarter-results/",
      "source_attribution": [
        {
          "source_name": "Apple Q2 FY2024 results release",
          "publisher": "Apple",
          "source_type": "company_investor_relations",
          "source_url": "https://www.apple.com/newsroom/2024/05/apple-reports-second-quarter-results/",
          "accessed_at": "2026-05-17",
          "static_notice": "Static case-study catalyst; not live data."
        }
      ]
    }
  ]
}
