{
  "schema_version": "0.1",
  "company": "ASML Holding N.V. Public-Source Semiconductor Equipment Fixture",
  "ticker": "ASML",
  "as_of": "2025-01-30",
  "data_cutoff": "2025-01-29",
  "source_attribution": [
    {
      "source_name": "ASML Q4 and full-year 2024 financial results",
      "publisher": "ASML Investor Relations",
      "source_type": "company_investor_relations",
      "source_url": "https://www.asml.com/news/press-releases/2025/q4-2024-financial-results",
      "accessed_at": "2026-05-17",
      "static_notice": "Static educational fixture assembled from a public company release; not live data."
    },
    {
      "source_name": "ASML publishes 2024 Annual Reports",
      "publisher": "ASML Investor Relations",
      "source_type": "press_release",
      "source_url": "https://www.asml.com/news/press-releases/2025/asml-publishes-2024-annual-reports",
      "accessed_at": "2026-05-17",
      "static_notice": "Static educational fixture assembled from public annual-report publication context; not live data."
    }
  ],
  "notes": [
    {
      "id": "asml-fy2024-record-sales",
      "date": "2025-01-29",
      "topic": "2024 net sales and gross margin",
      "type": "management_claim",
      "text": "Company release described 2024 as a record year with total net sales growth and resilient gross margin.",
      "evidence_url": "https://www.asml.com/news/press-releases/2025/q4-2024-financial-results",
      "source_attribution": [
        {
          "source_name": "ASML Q4 and full-year 2024 financial results",
          "publisher": "ASML Investor Relations",
          "source_type": "company_investor_relations",
          "source_url": "https://www.asml.com/news/press-releases/2025/q4-2024-financial-results",
          "accessed_at": "2026-05-17",
          "static_notice": "Static public-source excerpt; verify against the original release."
        }
      ]
    },
    {
      "id": "asml-bookings-backlog",
      "date": "2025-01-29",
      "topic": "bookings and backlog",
      "type": "management_claim",
      "text": "Management highlighted Q4 bookings and backlog as support for future growth opportunity in lithography demand.",
      "evidence_url": "https://www.asml.com/news/press-releases/2025/q4-2024-financial-results",
      "source_attribution": [
        {
          "source_name": "ASML Q4 and full-year 2024 financial results",
          "publisher": "ASML Investor Relations",
          "source_type": "company_investor_relations",
          "source_url": "https://www.asml.com/news/press-releases/2025/q4-2024-financial-results",
          "accessed_at": "2026-05-17",
          "static_notice": "Static public-source excerpt; verify against the original release."
        }
      ]
    },
    {
      "id": "asml-export-demand-risk",
      "date": "2025-01-29",
      "topic": "demand timing and export controls",
      "type": "company_risk_language",
      "text": "Forward-looking language noted customer demand timing, regulatory export controls, supply constraints, and customer delay risk could pressure results.",
      "evidence_url": "https://www.asml.com/news/press-releases/2025/q4-2024-financial-results",
      "source_attribution": [
        {
          "source_name": "ASML Q4 and full-year 2024 financial results",
          "publisher": "ASML Investor Relations",
          "source_type": "company_investor_relations",
          "source_url": "https://www.asml.com/news/press-releases/2025/q4-2024-financial-results",
          "accessed_at": "2026-05-17",
          "static_notice": "Static public-source risk-language excerpt; verify against the original release."
        }
      ]
    },
    {
      "id": "asml-q3-memory-cycle",
      "date": "2024-10-15",
      "topic": "memory customer cycle",
      "type": "user_synthesis",
      "text": "Prior quarter context flagged memory weakness and customer schedule delay risk while the industry recovery remained uneven.",
      "evidence_url": "https://www.asml.com/en/news/press-releases/2024/q3-2024-financial-results-dd3ac76a9d4d0f8c",
      "source_attribution": [
        {
          "source_name": "ASML Q3 2024 financial results",
          "publisher": "ASML Investor Relations",
          "source_type": "company_investor_relations",
          "source_url": "https://www.asml.com/en/news/press-releases/2024/q3-2024-financial-results-dd3ac76a9d4d0f8c",
          "accessed_at": "2026-05-17",
          "static_notice": "Static public-source context older than the fixture cutoff; verify freshness before reuse."
        }
      ]
    }
  ],
  "kpis": [
    {
      "name": "Q4 2024 net sales",
      "value": "EUR 9.3B",
      "direction": "up",
      "date": "2025-01-29",
      "observation": "Static release value shows quarterly growth at the end of a record fiscal year.",
      "evidence_url": "https://www.asml.com/news/press-releases/2025/q4-2024-financial-results",
      "source_attribution": [
        {
          "source_name": "ASML Q4 and full-year 2024 financial results",
          "publisher": "ASML Investor Relations",
          "source_type": "company_investor_relations",
          "source_url": "https://www.asml.com/news/press-releases/2025/q4-2024-financial-results",
          "accessed_at": "2026-05-17",
          "static_notice": "Static case-study KPI; not live data."
        }
      ]
    },
    {
      "name": "FY2024 gross margin",
      "value": "51.3%",
      "direction": "positive",
      "date": "2025-01-29",
      "observation": "Static release value indicates gross margin remained positive despite mixed end-market conditions.",
      "evidence_url": "https://www.asml.com/news/press-releases/2025/q4-2024-financial-results",
      "source_attribution": [
        {
          "source_name": "ASML Q4 and full-year 2024 financial results",
          "publisher": "ASML Investor Relations",
          "source_type": "company_investor_relations",
          "source_url": "https://www.asml.com/news/press-releases/2025/q4-2024-financial-results",
          "accessed_at": "2026-05-17",
          "static_notice": "Static case-study KPI; not live data."
        }
      ]
    },
    {
      "name": "Q4 2024 net bookings",
      "value": "EUR 7.1B",
      "direction": "positive",
      "date": "2025-01-29",
      "observation": "Bookings support pipeline visibility and future system shipment growth review.",
      "evidence_url": "https://www.asml.com/news/press-releases/2025/q4-2024-financial-results",
      "source_attribution": [
        {
          "source_name": "ASML Q4 and full-year 2024 financial results",
          "publisher": "ASML Investor Relations",
          "source_type": "company_investor_relations",
          "source_url": "https://www.asml.com/news/press-releases/2025/q4-2024-financial-results",
          "accessed_at": "2026-05-17",
          "static_notice": "Static case-study KPI; not live data."
        }
      ]
    }
  ],
  "catalysts": [
    {
      "date": "2025-04-16",
      "title": "Q1 2025 results update",
      "description": "Review whether bookings, customer demand timing, and gross margin trends remained consistent with the January outlook.",
      "expected_impact": "risk/opportunity review",
      "evidence_url": "https://www.asml.com/investors/financial-results/q4-2024",
      "source_attribution": [
        {
          "source_name": "ASML Q4 2024 financial results page",
          "publisher": "ASML Investor Relations",
          "source_type": "company_investor_relations",
          "source_url": "https://www.asml.com/investors/financial-results/q4-2024",
          "accessed_at": "2026-05-17",
          "static_notice": "Static catalyst context; not live data."
        }
      ]
    },
    {
      "date": "2025-03-14",
      "title": "Annual report review",
      "description": "Check the filed annual report for risk factors around export controls, supplier concentration, and customer demand timing.",
      "expected_impact": "source validation"
    }
  ]
}
