{
  "schema_version": "0.1",
  "company": "Northstar Grid & LNG Partners",
  "ticker": "NGLP",
  "as_of": "2026-05-15",
  "data_cutoff": "2026-04-25",
  "notes": [
    {
      "id": "nglp-n1",
      "date": "2026-04-25",
      "topic": "project execution",
      "type": "management_claim",
      "text": "Management said the Gulf Coast liquefaction train remains on schedule, but construction labor availability and turbine supply remain execution risks.",
      "evidence_url": "https://example.com/nglp/q1-2026-call"
    },
    {
      "id": "nglp-n2",
      "date": "2026-01-10",
      "topic": "permitting and regulatory",
      "type": "analyst_question",
      "text": "Analysts asked whether a regulatory investigation into pipeline right-of-way compliance could delay the interconnect expansion or create a permitting headwind.",
      "evidence_url": "https://example.com/nglp/infrastructure-conference"
    },
    {
      "id": "nglp-n3",
      "date": "2025-09-30",
      "topic": "capital cost inflation",
      "type": "user_synthesis",
      "text": "Static project tracker shows steel, transformer, and contractor costs increased, creating margin compression risk if fixed-price EPC protections are exhausted.",
      "evidence_url": "https://example.com/nglp/static-project-tracker"
    },
    {
      "id": "nglp-n4",
      "date": "2026-04-25",
      "topic": "contracted growth backlog",
      "type": "transcript_excerpt",
      "text": "New take-or-pay transmission contracts expand the rate-base pipeline and may accelerate EBITDA growth once the substations enter service."
    },
    {
      "id": "nglp-n5",
      "date": "2026-03-20",
      "topic": "financing plan",
      "type": "note",
      "text": "Management highlighted a record order book and said asset-sale proceeds could reduce external equity needs, but final proceeds are still unverified."
    }
  ],
  "kpis": [
    {
      "name": "Construction work in progress",
      "value": "$8.4B",
      "direction": "up",
      "date": "2026-04-25",
      "observation": "Higher capital deployed into regulated transmission and LNG expansion projects.",
      "evidence_url": "https://example.com/nglp/q1-2026-deck"
    },
    {
      "name": "Project cost variance",
      "value": "+11%",
      "direction": "worse",
      "date": "2025-12-31",
      "observation": "Static KPI shows cost pressure and supply delay exposure on transformers and gas turbines.",
      "evidence_url": "https://example.com/nglp/project-controls"
    },
    {
      "name": "Contracted capacity backlog",
      "value": "92%",
      "direction": "positive",
      "date": "2026-04-25",
      "observation": "Long-term contracted pipeline supports cash flow visibility and expansion opportunity."
    },
    {
      "name": "Debt to capital",
      "value": "63%",
      "direction": "negative",
      "date": "2026-02-01",
      "observation": "Elevated leverage may increase refinancing risk if rates remain high.",
      "evidence_url": "https://example.com/nglp/balance-sheet"
    }
  ],
  "catalysts": [
    {
      "date": "2026-06-30",
      "title": "Federal permit milestone",
      "description": "Review whether the pipeline interconnect receives final environmental clearance.",
      "expected_impact": "risk validation",
      "evidence_url": "https://example.com/nglp/permitting-calendar"
    },
    {
      "date": "2026-07-18",
      "title": "Rate-case filing",
      "description": "Updated capital plan may clarify allowed returns, recovery timing, and customer bill pressure.",
      "expected_impact": "risk/opportunity review"
    },
    {
      "date": "2026-09-15",
      "title": "LNG train mechanical completion window",
      "description": "Confirm whether construction progress supports the late-year commissioning target.",
      "expected_impact": "execution review",
      "evidence_url": "https://example.com/nglp/project-calendar"
    }
  ]
}
